{
  "id": "6a7b8c9d-0000-4000-8000-000000000005",
  "opdracht_uri": "https://grip.opdrachtgever.example/id/opdracht/3f2a8c54-6d1b-4f0e-9a77-1c2b3d4e5f60",
  "periode": {
    "begindatum": "2026-07-01",
    "einddatum": "2027-06-30"
  },
  "afgesproken": [
    "Bouwsteen Alfa in productie"
  ],
  "geleverd": [
    "Bouwsteen Alfa in productie"
  ],
  "niet_geleverd": [
    {
      "omschrijving": "Koppeling met register Beta",
      "reden": "Register was niet op tijd beschikbaar."
    }
  ],
  "totale_kosten": {
    "bedrag_centen": 110000000,
    "valuta": "EUR"
  },
  "samenvatting": "Fictief eindrapport.",
  "uitgegeven_op": "2027-07-15T16:00:00+02:00"
}
